[
  {
    "name": "spatio-flux",
    "source": "https://github.com/vivarium-collective/spatio-flux.git",
    "ref": "main",
    "package": "spatio_flux",
    "homepage": "https://github.com/vivarium-collective/spatio-flux",
    "description": "spatio-temporal microbial simulations with Vivarium 2.0",
    "tags": []
  },
  {
    "name": "v2ecoli",
    "source": "https://github.com/vivarium-collective/v2ecoli.git",
    "ref": "main",
    "package": "v2ecoli",
    "homepage": "https://github.com/vivarium-collective/v2ecoli",
    "description": "Whole-cell E. coli model in Vivarium 2",
    "tags": []
  },
  {
    "name": "viva-amici",
    "source": "https://github.com/vivarium-collective/viva-amici.git",
    "ref": "main",
    "package": "viva_amici",
    "homepage": "https://github.com/vivarium-collective/viva-amici",
    "description": "Process-bigraph wrapper for AMICI (CVODES-based ODE/DAE simulator). Real bridge to https://github.com/AMICI-dev/AMICI.",
    "tags": []
  },
  {
    "name": "viva-artistoo",
    "source": "https://github.com/vivarium-collective/viva-artistoo.git",
    "ref": "main",
    "package": "viva_artistoo",
    "homepage": "https://github.com/vivarium-collective/viva-artistoo",
    "description": "Process-bigraph wrapper for the Artistoo Cellular Potts Model (real simulator via a Node.js bridge)",
    "tags": []
  },
  {
    "name": "viva-autopoiesis",
    "source": "https://github.com/vivarium-collective/viva-autopoiesis.git",
    "ref": "main",
    "package": "viva_autopoiesis",
    "homepage": "https://github.com/vivarium-collective/viva-autopoiesis",
    "description": "A whole-cell model built as a precarious, self-bounding network via composition \u2014 autopoiesis through the biological schema framework.",
    "tags": []
  },
  {
    "name": "viva-biofilm",
    "source": "https://github.com/vivarium-collective/viva-biofilm.git",
    "ref": "main",
    "package": "viva_biofilm",
    "homepage": "https://github.com/vivarium-collective/viva-biofilm",
    "description": "Rust implementation of individual-based biofilm framework, for vivarium workspaces.",
    "tags": []
  },
  {
    "name": "viva-biomodels",
    "source": "https://github.com/vivarium-collective/viva-biomodels.git",
    "ref": "main",
    "package": "viva_biomodels",
    "homepage": "https://github.com/vivarium-collective/viva-biomodels",
    "description": "Process-bigraph workspace: BIOMODELS regression \u2014 installs pbg-biomodels-bundle and drives investigations against the BioModels corpus",
    "tags": []
  },
  {
    "name": "viva-bioreactordesign",
    "source": "https://github.com/vivarium-collective/viva-bioreactordesign.git",
    "ref": "main",
    "package": "viva_bioreactordesign",
    "homepage": "https://github.com/vivarium-collective/viva-bioreactordesign",
    "description": "Process-bigraph wrapper for BioReactorDesign (BiRD) bioreactor simulation",
    "tags": []
  },
  {
    "name": "viva-caspule",
    "source": "https://github.com/vivarium-collective/viva-caspule.git",
    "ref": "main",
    "package": "viva_caspule",
    "homepage": "https://github.com/vivarium-collective/viva-caspule",
    "description": "Process-bigraph wrapper for CASPULE (a LAMMPS variant with dynamic bond formation/breaking)",
    "tags": []
  },
  {
    "name": "viva-chaste",
    "source": "https://github.com/vivarium-collective/viva-chaste.git",
    "ref": "main",
    "package": "viva_chaste",
    "homepage": "https://github.com/vivarium-collective/viva-chaste",
    "description": "Process-bigraph wrapper for the Chaste cell-based simulator, run via the chaste/pychaste Docker image.",
    "tags": []
  },
  {
    "name": "viva-comets",
    "source": "https://github.com/vivarium-collective/viva-comets.git",
    "ref": "main",
    "package": "viva_comets",
    "homepage": "https://github.com/vivarium-collective/viva-comets",
    "description": "Process-bigraph wrapper for COMETS (dynamic FBA + 2D spatial microbial ecosystems)",
    "tags": []
  },
  {
    "name": "viva-composite-nfsim-caspule",
    "source": "https://github.com/vivarium-collective/viva-composite-nfsim-caspule.git",
    "ref": "main",
    "package": "viva_composite_nfsim_caspule",
    "homepage": "https://github.com/vivarium-collective/viva-composite-nfsim-caspule",
    "description": "Process-bigraph composite: CASPULE bond-aware MD coupled to NFSim rule-based kinetics through a configurable observable detector that converts spatial bond clusters into non-spatial species counts.",
    "tags": []
  },
  {
    "name": "viva-compucell3d",
    "source": "https://github.com/vivarium-collective/viva-compucell3d.git",
    "ref": "main",
    "package": "viva_compucell3d",
    "homepage": "https://github.com/vivarium-collective/viva-compucell3d",
    "description": "Process-bigraph wrapper for the CompuCell3D multicellular simulation environment",
    "tags": []
  },
  {
    "name": "viva-copasi",
    "source": "https://github.com/vivarium-collective/viva-copasi.git",
    "ref": "main",
    "package": "viva_copasi",
    "homepage": "https://github.com/vivarium-collective/viva-copasi",
    "description": "process-bigraph-compatible COPASI Steps and Processes for SBML simulation",
    "tags": []
  },
  {
    "name": "viva-cpm",
    "source": "https://github.com/vivarium-collective/viva-cpm.git",
    "ref": "main",
    "package": "viva_cpm",
    "homepage": "https://github.com/vivarium-collective/viva-cpm",
    "description": "Vivarium-native Cellular Potts Model framework \u2014 with a fast Rust core",
    "tags": []
  },
  {
    "name": "viva-emitters",
    "source": "https://github.com/vivarium-collective/viva-emitters.git",
    "ref": "main",
    "package": "viva_emitters",
    "homepage": "https://github.com/vivarium-collective/viva-emitters",
    "description": "emitter library for vivarium simulations",
    "tags": []
  },
  {
    "name": "viva-fenics",
    "source": "https://github.com/vivarium-collective/viva-fenics.git",
    "ref": "main",
    "package": "viva_fenics",
    "homepage": "https://github.com/vivarium-collective/viva-fenics",
    "description": "Process-bigraph wrapper for FEniCSx (dolfinx)",
    "tags": []
  },
  {
    "name": "viva-human-atlas",
    "source": "https://github.com/vivarium-collective/viva-human-atlas.git",
    "ref": "main",
    "package": "viva_human_atlas",
    "homepage": "https://github.com/vivarium-collective/viva-human-atlas",
    "description": "HRA/WPP modeling workspace",
    "tags": []
  },
  {
    "name": "viva-lammps",
    "source": "https://github.com/vivarium-collective/viva-lammps.git",
    "ref": "main",
    "package": "viva_lammps",
    "homepage": "https://github.com/vivarium-collective/viva-lammps",
    "description": "Process-bigraph wrapper for the LAMMPS molecular dynamics simulator",
    "tags": []
  },
  {
    "name": "viva-martini",
    "source": "https://github.com/vivarium-collective/viva-martini.git",
    "ref": "main",
    "package": "viva_martini",
    "homepage": "https://github.com/vivarium-collective/viva-martini",
    "description": "Process-bigraph wrapper for the Martini coarse-grained force field \u2014 membrane systems, micelles, protein-lipid complexes, and vesicles",
    "tags": []
  },
  {
    "name": "viva-medyan",
    "source": "https://github.com/vivarium-collective/viva-medyan.git",
    "ref": "main",
    "package": "viva_medyan",
    "homepage": "https://github.com/vivarium-collective/viva-medyan",
    "description": "Process-bigraph wrapper for the MEDYAN cytoskeleton simulator: pure-Python re-implementation + a subprocess-driven bridge to the real MEDYAN C++ binary (with checkpoint-restart and HDF5 vesicle support).",
    "tags": []
  },
  {
    "name": "viva-mem3dg",
    "source": "https://github.com/vivarium-collective/viva-mem3dg.git",
    "ref": "main",
    "package": "viva_mem3dg",
    "homepage": "https://github.com/vivarium-collective/viva-mem3dg",
    "description": "Process-bigraph wrapper for Mem3DG membrane mechanics simulator",
    "tags": []
  },
  {
    "name": "viva-membrane-actin-composite",
    "source": "https://github.com/vivarium-collective/viva-membrane-actin-composite.git",
    "ref": "main",
    "package": "viva_membrane_actin_composite",
    "homepage": "https://github.com/vivarium-collective/viva-membrane-actin-composite",
    "description": "Process-bigraph composite: pbg-mem3dg + pbg-readdy as a Brownian ratchet (actin pushing on membrane, closed-loop)",
    "tags": []
  },
  {
    "name": "Viva-munk",
    "source": "https://github.com/vivarium-collective/Viva-munk.git",
    "ref": "main",
    "package": "Viva_munk",
    "homepage": "https://github.com/vivarium-collective/Viva-munk",
    "description": "vivarium wrapper for pymunk",
    "tags": []
  },
  {
    "name": "viva-nfsim",
    "source": "https://github.com/vivarium-collective/viva-nfsim.git",
    "ref": "main",
    "package": "viva_nfsim",
    "homepage": "https://github.com/vivarium-collective/viva-nfsim",
    "description": "A process-bigraph wrapper for BioNetGen/NFSim",
    "tags": []
  },
  {
    "name": "viva-openmm",
    "source": "https://github.com/vivarium-collective/viva-openmm.git",
    "ref": "main",
    "package": "viva_openmm",
    "homepage": "https://github.com/vivarium-collective/viva-openmm",
    "description": "process-bigraph OpenMM MD wrapper (Martini CG + all-atom solvated relax)",
    "tags": []
  },
  {
    "name": "viva-oxidizeme",
    "source": "https://github.com/vivarium-collective/viva-oxidizeme.git",
    "ref": "main",
    "package": "viva_oxidizeme",
    "homepage": "https://github.com/vivarium-collective/viva-oxidizeme",
    "description": "Process-bigraph wrapper for OxidizeME \u2014 a genome-scale ME-model of E. coli with ROS damage/repair (Yang et al. 2019 PNAS / Palsson lab)",
    "tags": []
  },
  {
    "name": "viva-parsimony",
    "source": "https://github.com/vivarium-collective/viva-parsimony.git",
    "ref": "main",
    "package": "viva_parsimony",